{"type":"config","name":"Compress Trekoon skill instructions","metricName":"total_words","metricUnit":"","bestDirection":"lower"}
{"run":1,"commit":"465fee5","metric":4867,"metrics":{"words_SKILL":786,"words_execution":1282,"words_planning":1524,"words_sync":391,"guard_recoveryrequired":2,"guard_task_claim":7,"guard___append":15,"guard_task_done":14,"guard_blocked":30,"guard_subagent":26,"guard___toon":68,"guard_wipe___yes":2},"status":"keep","description":"Baseline word-count harness and autoresearch notes for current Trekoon skill","timestamp":1779097559552,"segment":0,"confidence":null,"asi":{"hypothesis":"Establish measurement baseline before compression; parsed total differs from wc -w because script uses regex token-ish words.","baseline_wc_w_total":5372,"target_words_approx":3223}}
{"run":2,"commit":"failed","metric":0,"metrics":{"words_SKILL":786,"words_execution":1282,"words_planning":1524,"words_sync":391,"guard_recoveryrequired":2,"guard_task_claim":7,"guard___append":15,"guard_task_done":14,"guard_blocked":30,"guard_subagent":26,"guard___toon":68,"guard_wipe___yes":2},"status":"crash","description":"Attempted to run eval seed through run_experiment; tool rejected custom command because autoresearch.sh is authoritative","timestamp":1779097591463,"segment":0,"confidence":null,"asi":{"hypothesis":"Use run_experiment for eval seeding as baseline gate","rollback_reason":"Autoresearch tool only allows ./autoresearch.sh when present; use bash for eval seeding and keep run_experiment for metric harness.","next_action_hint":"Run eval seed via bash, then use evaluator worker for rubric scoring; continue metric runs with ./autoresearch.sh."}}
{"run":3,"commit":"64fdf28","metric":3620,"metrics":{"words_SKILL":634,"words_execution":945,"words_planning":1062,"words_sync":295,"guard_recoveryrequired":2,"guard_task_claim":6,"guard___append":15,"guard_task_done":12,"guard_blocked":29,"guard_subagent":18,"guard___toon":68,"guard_wipe___yes":2},"status":"keep","description":"Compression v1: dense rewrite of Trekoon skill references while preserving kickoff rubric behavior","timestamp":1779098281832,"segment":0,"confidence":null,"asi":{"hypothesis":"Remove tutorial prose and repetition across all skill references while retaining explicit agent workflow primitives and guardrails.","eval_score_total":52,"eval_execution_kickoff":16,"eval_sync_safety":10,"eval_hard_fails":0,"eval_ready_task_identified":true,"eval_blocked_tasks_deferred":true,"word_reduction_vs_baseline_pct":25.6,"notes":"Candidate matched baseline score; biggest remaining reduction opportunity is planning compact-spec section and Agent Teams appendix."}}
{"run":4,"commit":"92b5a3f","metric":2658,"metrics":{"words_SKILL":539,"words_execution":666,"words_planning":658,"words_sync":248,"guard_recoveryrequired":2,"guard_task_claim":6,"guard___append":13,"guard_task_done":12,"guard_blocked":26,"guard_subagent":14,"guard___toon":51,"guard_wipe___yes":2},"status":"keep","description":"Compression v2: aggressive consolidation to below 3k words with rubric-passing kickoff","timestamp":1779099050483,"segment":0,"confidence":2.2962577962577964,"asi":{"hypothesis":"Further consolidate compact-spec, execution prompt, and repeated workflow language while preserving explicit kickoff, claim, blocked-task, and verification semantics.","eval_score_total":54,"eval_execution_kickoff":16,"eval_sync_safety":10,"eval_hard_fails":0,"eval_ready_task_identified":true,"eval_blocked_tasks_deferred":true,"word_reduction_vs_regex_baseline_pct":45.4,"word_reduction_vs_wc_baseline_pct_estimate":"~44% from 5372 wc baseline to ~2999 worker regex/wc-ish total; exact wc should be checked separately","notes":"This surpasses the 40% goal and improved rubric score in the eval response; remaining reductions risk over-compression of cross-harness and compact-spec safety."}}
{"run":5,"commit":"e0f5ea7","metric":2546,"metrics":{"words_SKILL":528,"words_execution":648,"words_planning":606,"words_sync":243,"guard_recoveryrequired":2,"guard_task_claim":6,"guard___append":13,"guard_task_done":12,"guard_blocked":24,"guard_subagent":14,"guard___toon":51,"guard_wipe___yes":2},"status":"keep","description":"Compression v3: small safe trim beyond goal; kickoff still passes thresholds","timestamp":1779099669044,"segment":0,"confidence":4.322160148975791,"asi":{"hypothesis":"Remove residual redundancy after v2 without changing safety sections or workflow structure.","eval_score_total":51,"eval_execution_kickoff":16,"eval_sync_safety":10,"eval_hard_fails":0,"eval_ready_task_identified":true,"eval_blocked_tasks_deferred":true,"word_reduction_vs_regex_baseline_pct":47.7,"tradeoff":"Rubric score dropped from v2 54 to 51 but remains above all gates; primary metric improved by 112 words.","next_action_hint":"Further compression should restore explicit feature/files/reviewer wording if it risks subagent/planning deductions."}}
{"run":6,"commit":"262c998","metric":2399,"metrics":{"words_SKILL":494,"words_execution":620,"words_planning":559,"words_sync":231,"guard_recoveryrequired":2,"guard_task_claim":6,"guard___append":13,"guard_task_done":12,"guard_blocked":24,"guard_subagent":14,"guard___toon":51,"guard_wipe___yes":2},"status":"keep","description":"Compression v4: boundary trim below 2400 words while restoring full kickoff rubric score","timestamp":1779100423572,"segment":0,"confidence":9.528957528957529,"asi":{"hypothesis":"Boundary compression can reduce another ~150 words by abbreviating dense sections while restoring explicit feature/files/reviewer cues from v3.","eval_score_total":54,"eval_execution_kickoff":16,"eval_sync_safety":10,"eval_hard_fails":0,"eval_ready_task_identified":true,"eval_blocked_tasks_deferred":true,"word_reduction_vs_regex_baseline_pct":50.7,"tradeoff":"Very dense wording and only one word below 2400; future additions should be offset elsewhere.","next_action_hint":"Further reductions are possible but risk readability; target only obvious repeated command prose or consider stopping soon if no new safe cuts appear."}}
{"run":7,"commit":"1f6ec09","metric":2382,"metrics":{"words_SKILL":491,"words_execution":615,"words_planning":553,"words_sync":230,"guard_recoveryrequired":2,"guard_task_claim":6,"guard___append":13,"guard_task_done":12,"guard_blocked":24,"guard_subagent":13,"guard___toon":51,"guard_wipe___yes":2},"status":"keep","description":"Compression v5: low-risk wording trim after v4; eval kickoff still scores 54/54","timestamp":1779100631393,"segment":0,"confidence":11.749408983451536,"asi":{"hypothesis":"Trim only redundant wording and phrasing in router/execution/planning/review docs to reduce words without changing workflow structure or eval-critical commands.","eval_score_total":54,"eval_execution_kickoff":16,"eval_sync_safety":10,"eval_hard_fails":0,"eval_ready_task_identified":true,"eval_blocked_tasks_deferred":true,"word_reduction_vs_previous_best":17,"word_reduction_vs_regex_baseline_pct":51.1,"tradeoff":"Small improvement; guard_subagent count dropped by one but evaluator still produced full orchestration behavior.","next_action_hint":"Future iterations should be cautious: look for duplicated prose in sync/status or command examples, but avoid removing explicit subagent/orchestrator cues."}}
{"run":8,"commit":"299eae2","metric":2318,"metrics":{"words_SKILL":500,"words_execution":615,"words_planning":553,"words_sync":230,"guard_recoveryrequired":2,"guard_task_claim":6,"guard___append":13,"guard_task_done":11,"guard_blocked":23,"guard_subagent":13,"guard___toon":51,"guard_wipe___yes":2},"status":"keep","description":"Compression v6: merge status-machine guidance into router and remove separate status reference","timestamp":1779100791145,"segment":0,"confidence":15.542682926829269,"asi":{"hypothesis":"Inline the small status-machine reference into SKILL.md and delete the separate reference file to reduce loaded word count without weakening status safety.","eval_score_total":54,"eval_execution_kickoff":16,"eval_sync_safety":10,"eval_hard_fails":0,"eval_ready_task_identified":true,"eval_blocked_tasks_deferred":true,"word_reduction_vs_previous_best":64,"word_reduction_vs_regex_baseline_pct":52.4,"status_safety_preserved":"SKILL.md now includes valid transitions, status_transition_invalid, task done auto-walk, subtask done requirement, and blocked reason/evidence/unblock condition.","risk_checked":"grep found no remaining status-machine references after deletion; reviewer noted possible stale reference but local grep did not confirm.","next_action_hint":"Next iteration can look for small safe trims in command examples; avoid deleting more status/subagent/orchestrator cues."}}
{"run":9,"commit":"db8ce95","metric":2310,"metrics":{"words_SKILL":500,"words_execution":615,"words_planning":553,"words_sync":223,"guard_recoveryrequired":2,"guard_task_claim":6,"guard___append":13,"guard_task_done":11,"guard_blocked":23,"guard_subagent":13,"guard___toon":51,"guard_wipe___yes":2},"status":"keep","description":"Compression v7: small sync and harness wording trim with kickoff still scoring 54/54","timestamp":1779100951775,"segment":0,"confidence":16.13249211356467,"asi":{"hypothesis":"Trim low-value sync and harness prose while preserving concrete recovery, destructive, subagent, claim/progress, and verification cues.","eval_score_total":54,"eval_execution_kickoff":16,"eval_sync_safety":10,"eval_hard_fails":0,"eval_ready_task_identified":true,"eval_blocked_tasks_deferred":true,"word_reduction_vs_previous_best":8,"word_reduction_vs_regex_baseline_pct":52.5,"tradeoff":"Very small win; wording is increasingly dense, so future iterations should target only clearly redundant phrases or examples.","next_action_hint":"Potential next: inspect planning compact-spec section for one or two redundant lines; avoid reducing guard term counts further if possible."}}
{"type":"config","name":"Compress Trekoon skill instructions","metricName":"total_words","metricUnit":"","bestDirection":"lower"}
{"run":10,"commit":"d0e71c2","metric":2307,"metrics":{"words_SKILL":500,"words_execution":612,"words_planning":553,"words_sync":223,"guard_recoveryrequired":2,"guard_task_claim":6,"guard___append":13,"guard_task_done":11,"guard_blocked":23,"guard_subagent":13,"guard___toon":51,"guard_wipe___yes":2},"status":"keep","description":"Baseline current compressed Trekoon skill files before continuing experiments","timestamp":1779101502098,"segment":1,"confidence":null,"asi":{"hypothesis":"Record the current compressed state as the baseline for the resumed autoresearch loop."}}
{"run":11,"commit":"3d2f1de","metric":2276,"metrics":{"words_SKILL":500,"words_execution":612,"words_planning":522,"words_sync":223,"guard_recoveryrequired":2,"guard_task_claim":6,"guard___append":13,"guard_task_done":11,"guard_blocked":23,"guard_subagent":13,"guard___toon":51,"guard_wipe___yes":2},"status":"keep","description":"Condense planning compact-spec hazard guidance","timestamp":1779101533267,"segment":1,"confidence":null,"asi":{"hypothesis":"A tighter compact-spec hazards section can preserve pipe-splitting guardrails while reducing planning reference words."}}
{"run":12,"commit":"88f61e4","metric":2266,"metrics":{"words_SKILL":500,"words_execution":602,"words_planning":522,"words_sync":223,"guard_recoveryrequired":2,"guard_task_claim":6,"guard___append":13,"guard_task_done":11,"guard_blocked":24,"guard_subagent":13,"guard___toon":51,"guard_wipe___yes":2},"status":"keep","description":"Tighten execution lane subagent prompt template","timestamp":1779101554443,"segment":1,"confidence":4.1,"asi":{"hypothesis":"The lane prompt can be shorter without losing claim/append/done, blocking, scope, review, and no-branch guardrails."}}
{"run":13,"commit":"8837d18","metric":2263,"metrics":{"words_SKILL":497,"words_execution":602,"words_planning":522,"words_sync":223,"guard_recoveryrequired":2,"guard_task_claim":6,"guard___append":13,"guard_task_done":11,"guard_blocked":24,"guard_subagent":12,"guard___toon":51,"guard_wipe___yes":2},"status":"keep","description":"Trim top-level mode and execution defaults wording","timestamp":1779101575737,"segment":1,"confidence":6.769230769230769,"asi":{"hypothesis":"Small top-level wording reductions can keep routing and execution defaults intact while shaving tokens.","note":"guard_subagent dropped by one because one sentence now says delegate independent work instead of default to subagents."}}
{"run":14,"commit":"8837d18","metric":2263,"metrics":{"words_SKILL":497,"words_execution":602,"words_planning":522,"words_sync":223,"guard_recoveryrequired":2,"guard_task_claim":6,"guard___append":13,"guard_task_done":11,"guard_blocked":24,"guard_subagent":12,"guard___toon":51,"guard_wipe___yes":2},"status":"discard","description":"Rerun unchanged metric script for measurement stability","timestamp":1779101589551,"segment":1,"confidence":14.666666666666666,"asi":{"hypothesis":"Confirm current word count is stable before selecting the next edit.","rollback_reason":"No source edit was made and primary metric was unchanged.","next_action_hint":"Continue with a new compression candidate, likely harness-primitives or execution close sections."}}
{"run":15,"commit":"7ea5868","metric":2228,"metrics":{"words_SKILL":497,"words_execution":602,"words_planning":522,"words_sync":223,"guard_recoveryrequired":2,"guard_task_claim":6,"guard___append":13,"guard_task_done":11,"guard_blocked":24,"guard_subagent":12,"guard___toon":51,"guard_wipe___yes":2},"status":"keep","description":"Condense harness runtime and compact-spec notes","timestamp":1779101618218,"segment":1,"confidence":12.153846153846153,"asi":{"hypothesis":"Harness runtime notes and duplicate compact-spec warnings can be more telegraphic while retaining multi-harness orchestration and pipe guardrails."}}
{"run":16,"commit":"2cc27f7","metric":2224,"metrics":{"words_SKILL":497,"words_execution":602,"words_planning":522,"words_sync":219,"guard_recoveryrequired":2,"guard_task_claim":6,"guard___append":13,"guard_task_done":11,"guard_blocked":24,"guard_subagent":12,"guard___toon":51,"guard_wipe___yes":2},"status":"keep","description":"Trim sync worktree/destructive wording","timestamp":1779101652038,"segment":1,"confidence":6.384615384615385,"asi":{"hypothesis":"Sync guidance can lose a few redundant words while preserving shared DB and destructive wipe warnings."}}
{"run":17,"commit":"e5c6787","metric":2219,"metrics":{"words_SKILL":497,"words_execution":597,"words_planning":522,"words_sync":219,"guard_recoveryrequired":2,"guard_task_claim":6,"guard___append":13,"guard_task_done":11,"guard_blocked":24,"guard_subagent":12,"guard___toon":51,"guard_wipe___yes":2},"status":"keep","description":"Tighten execution recovery and update cheat sheet","timestamp":1779101677249,"segment":1,"confidence":3.6666666666666665,"asi":{"hypothesis":"Minor wording compression in execution recovery/update sections will reduce words without touching behavior-critical commands."}}
{"run":18,"commit":"da82b5d","metric":2215,"metrics":{"words_SKILL":497,"words_execution":597,"words_planning":518,"words_sync":219,"guard_recoveryrequired":2,"guard_task_claim":6,"guard___append":13,"guard_task_done":11,"guard_blocked":24,"guard_subagent":12,"guard___toon":51,"guard_wipe___yes":2},"status":"keep","description":"Trim planning model quality descriptions","timestamp":1779101698682,"segment":1,"confidence":2.6285714285714286,"asi":{"hypothesis":"Planning quality bullets can be shortened while retaining required task scope, verification, dependency, and lane information."}}
{"run":19,"commit":"689d79b","metric":2211,"metrics":{"words_SKILL":493,"words_execution":597,"words_planning":518,"words_sync":219,"guard_recoveryrequired":2,"guard_task_claim":6,"guard___append":13,"guard_task_done":11,"guard_blocked":24,"guard_subagent":12,"guard___toon":51,"guard_wipe___yes":2},"status":"keep","description":"Shorten top-level load/done guardrail wording","timestamp":1779101965703,"segment":1,"confidence":4,"asi":{"hypothesis":"Top-level load and completion rules can be tightened without changing routing or execution safety.","eval_gate":"Post-compression skip-research kickoff was scored by reviewer as PASS 54/54, execution kickoff 16/16, sync/recovery/status 10/10, no hard fails."}}
{"run":20,"commit":"6d3bcb5","metric":2209,"metrics":{"words_SKILL":493,"words_execution":597,"words_planning":516,"words_sync":219,"guard_recoveryrequired":2,"guard_task_claim":6,"guard___append":13,"guard_task_done":11,"guard_blocked":24,"guard_subagent":12,"guard___toon":51,"guard_wipe___yes":2},"status":"keep","description":"Trim planning handoff/search wording","timestamp":1779101984605,"segment":1,"confidence":5.157894736842105,"asi":{"hypothesis":"Planning handoff and scoped search instructions can lose redundant words while preserving UUID handoff and preview-before-apply guardrails."}}
{"run":21,"commit":"6d3bcb5","metric":2209,"metrics":{"words_SKILL":493,"words_execution":597,"words_planning":516,"words_sync":219,"guard_recoveryrequired":2,"guard_task_claim":6,"guard___append":13,"guard_task_done":11,"guard_blocked":24,"guard_subagent":12,"guard___toon":51,"guard_wipe___yes":2},"status":"discard","description":"Try punctuation-only execution verification tightening","timestamp":1779102005553,"segment":1,"confidence":5.764705882352941,"asi":{"hypothesis":"Changing execution verification punctuation might reduce tokenized word count.","rollback_reason":"Primary metric unchanged at 2209 words.","next_action_hint":"Avoid punctuation-only edits; look for removable duplicate phrases instead."}}
{"run":22,"commit":"cecba9d","metric":2207,"metrics":{"words_SKILL":491,"words_execution":597,"words_planning":516,"words_sync":219,"guard_recoveryrequired":2,"guard_task_claim":6,"guard___append":13,"guard_task_done":11,"guard_blocked":24,"guard_subagent":12,"guard___toon":51,"guard_wipe___yes":2},"status":"keep","description":"Merge compact-read guardrail into small-read bullet","timestamp":1779102035672,"segment":1,"confidence":6.666666666666667,"asi":{"hypothesis":"The separate compact-read guardrail duplicates the small-read bullet and can be merged while keeping subagent/noisy-read guidance."}}
{"run":23,"commit":"7597484","metric":2206,"metrics":{"words_SKILL":491,"words_execution":597,"words_planning":516,"words_sync":219,"guard_recoveryrequired":2,"guard_task_claim":6,"guard___append":13,"guard_task_done":11,"guard_blocked":24,"guard_subagent":12,"guard___toon":51,"guard_wipe___yes":2},"status":"keep","description":"Remove redundant required from harness test row","timestamp":1779102067420,"segment":1,"confidence":7.481481481481482,"asi":{"hypothesis":"A tiny harness table wording reduction preserves the expectation to run checks for touched scope."}}
{"run":24,"commit":"4f5f2ee","metric":2200,"metrics":{"words_SKILL":491,"words_execution":597,"words_planning":516,"words_sync":219,"guard_recoveryrequired":2,"guard_task_claim":6,"guard___append":13,"guard_task_done":11,"guard_blocked":24,"guard_subagent":12,"guard___toon":51,"guard_wipe___yes":2},"status":"keep","description":"Condense harness atomic-claim semantics paragraph","timestamp":1779102120478,"segment":1,"confidence":8.916666666666666,"asi":{"hypothesis":"The atomic claim/append/done semantics paragraph can be shorter while preserving safe claim races, append-only logging, bulk append limits, and subtask done transitions."}}
{"run":25,"commit":"c43c68f","metric":2199,"metrics":{"words_SKILL":491,"words_execution":596,"words_planning":516,"words_sync":219,"guard_recoveryrequired":2,"guard_task_claim":6,"guard___append":13,"guard_task_done":11,"guard_blocked":24,"guard_subagent":12,"guard___toon":51,"guard_wipe___yes":2},"status":"keep","description":"Trim execution opening and lane-sizing wording","timestamp":1779102155106,"segment":1,"confidence":9.818181818181818,"asi":{"hypothesis":"Small execution-reference wording reductions can preserve done criteria and lane sizing while shaving remaining redundant words."}}
{"run":26,"commit":"62bafb4","metric":2197,"metrics":{"words_SKILL":491,"words_execution":596,"words_planning":514,"words_sync":219,"guard_recoveryrequired":2,"guard_task_claim":6,"guard___append":13,"guard_task_done":11,"guard_blocked":24,"guard_subagent":12,"guard___toon":51,"guard_wipe___yes":2},"status":"keep","description":"Shorten planning creation table labels","timestamp":1779102193618,"segment":1,"confidence":8.461538461538462,"asi":{"hypothesis":"Planning creation table labels and placeholder names can be shortened without changing command semantics or compact-spec safety guidance."}}
{"run":27,"commit":"2868981","metric":2195,"metrics":{"words_SKILL":489,"words_execution":596,"words_planning":514,"words_sync":219,"guard_recoveryrequired":2,"guard_task_claim":6,"guard___append":13,"guard_task_done":11,"guard_blocked":24,"guard_subagent":12,"guard___toon":51,"guard_wipe___yes":2},"status":"keep","description":"Trim top-level execution and recovery wording","timestamp":1779102222652,"segment":1,"confidence":8.296296296296296,"asi":{"hypothesis":"A few top-level wording reductions can preserve subagent-blocking behavior and recoveryRequired handling while reducing words."}}
{"run":28,"commit":"fd26bad","metric":2193,"metrics":{"words_SKILL":489,"words_execution":594,"words_planning":514,"words_sync":219,"guard_recoveryrequired":2,"guard_task_claim":6,"guard___append":13,"guard_task_done":11,"guard_blocked":24,"guard_subagent":12,"guard___toon":51,"guard_wipe___yes":2},"status":"keep","description":"Tighten execution lane brief wording","timestamp":1779102252840,"segment":1,"confidence":8.76923076923077,"asi":{"hypothesis":"The execution lane prompt can replace verbose labels with shorter equivalents while preserving bounded scope, claim/progress rules, and final deliverables."}}
