{"run":29,"commit":"a41cb63","metric":2192,"metrics":{"words_SKILL":489,"words_execution":594,"words_planning":514,"words_sync":218,"guard_recoveryrequired":2,"guard_task_claim":6,"guard___append":13,"guard_task_done":11,"guard_blocked":24,"guard_subagent":12,"guard___toon":51,"guard_wipe___yes":2},"status":"keep","description":"Trim sync no-op wording","timestamp":1779102283987,"segment":1,"confidence":8.518518518518519,"asi":{"hypothesis":"The sync overview can shorten same-branch no-op wording without weakening shared DB, cross-branch import, or copy/commit guardrails."}}
{"run":30,"commit":"611ac5f","metric":2189,"metrics":{"words_SKILL":489,"words_execution":591,"words_planning":514,"words_sync":218,"guard_recoveryrequired":2,"guard_task_claim":6,"guard___append":13,"guard_task_done":11,"guard_blocked":24,"guard_subagent":12,"guard___toon":51,"guard_wipe___yes":2},"status":"keep","description":"Compress execution subtask and bulk-update wording","timestamp":1779102320527,"segment":1,"confidence":8.428571428571429,"asi":{"hypothesis":"Execution work-loop and bulk-update wording can be shortened while preserving subtask claim-before-done and append/description exclusivity rules."}}
{"run":31,"commit":"72b774f","metric":2186,"metrics":{"words_SKILL":489,"words_execution":591,"words_planning":511,"words_sync":218,"guard_recoveryrequired":2,"guard_task_claim":6,"guard___append":13,"guard_task_done":11,"guard_blocked":24,"guard_subagent":12,"guard___toon":51,"guard_wipe___yes":2},"status":"keep","description":"Condense planning intro question guidance","timestamp":1779102356047,"segment":1,"confidence":8.344827586206897,"asi":{"hypothesis":"The planning intro can be tightened while preserving executable-DAG intent and the question/choice guidance agents need before writing plans."}}
{"run":32,"commit":"edf6105","metric":2185,"metrics":{"words_SKILL":489,"words_execution":591,"words_planning":510,"words_sync":218,"guard_recoveryrequired":2,"guard_task_claim":6,"guard___append":13,"guard_task_done":11,"guard_blocked":24,"guard_subagent":12,"guard___toon":51,"guard_wipe___yes":2},"status":"keep","description":"Shorten planning subtask scope wording","timestamp":1779102393525,"segment":1,"confidence":8.133333333333333,"asi":{"hypothesis":"Subtask scope inheritance can be stated more compactly without weakening task description quality or file-scope preservation."}}
{"run":33,"commit":"81c13e6","metric":2184,"metrics":{"words_SKILL":489,"words_execution":590,"words_planning":510,"words_sync":218,"guard_recoveryrequired":2,"guard_task_claim":6,"guard___append":13,"guard_task_done":11,"guard_blocked":24,"guard_subagent":12,"guard___toon":51,"guard_wipe___yes":2},"status":"keep","description":"Tighten Claude Agent Teams execution flow wording","timestamp":1779102429195,"segment":1,"confidence":7.935483870967742,"asi":{"hypothesis":"Claude Agent Teams guidance can be shortened slightly while preserving explicit opt-in, env gate, standard subagent fallback, tools, and flow."}}
{"run":34,"commit":"cbe8a76","metric":2176,"metrics":{"words_SKILL":489,"words_execution":590,"words_planning":510,"words_sync":218,"guard_recoveryrequired":2,"guard_task_claim":6,"guard___append":13,"guard_task_done":11,"guard_blocked":24,"guard_subagent":12,"guard___toon":51,"guard_wipe___yes":2},"status":"keep","description":"Compress harness delegation and review lists","timestamp":1779102462210,"segment":1,"confidence":8.733333333333333,"asi":{"hypothesis":"Harness delegation and review-scope lists can use slash compaction while preserving default delegation, parent coordination, permission prompt, and review coverage."}}
{"run":35,"commit":"d884819","metric":2170,"metrics":{"words_SKILL":489,"words_execution":584,"words_planning":510,"words_sync":218,"guard_recoveryrequired":2,"guard_task_claim":6,"guard___append":13,"guard_task_done":11,"guard_blocked":24,"guard_subagent":12,"guard___toon":51,"guard_wipe___yes":2},"status":"keep","description":"Slash-compact execution review risk list","timestamp":1779102490576,"segment":1,"confidence":8.5625,"asi":{"hypothesis":"Execution review coverage can use the same slash-compacted risk list as harness guidance while preserving the required review dimensions and verification rules."}}
{"run":36,"commit":"bc97cdc","metric":2167,"metrics":{"words_SKILL":489,"words_execution":584,"words_planning":507,"words_sync":218,"guard_recoveryrequired":2,"guard_task_claim":6,"guard___append":13,"guard_task_done":11,"guard_blocked":24,"guard_subagent":12,"guard___toon":51,"guard_wipe___yes":2},"status":"keep","description":"Hyphen-compact planning task scope labels","timestamp":1779102519914,"segment":1,"confidence":8.235294117647058,"asi":{"hypothesis":"Planning task description labels can use hyphenated shorthand for read-first and do-not-touch scope without losing the file-scope requirements agents need."}}
{"run":37,"commit":"9d44d43","metric":2166,"metrics":{"words_SKILL":489,"words_execution":584,"words_planning":506,"words_sync":218,"guard_recoveryrequired":2,"guard_task_claim":6,"guard___append":13,"guard_task_done":11,"guard_blocked":24,"guard_subagent":12,"guard___toon":51,"guard_wipe___yes":2},"status":"keep","description":"Shorten planning integration compatibility label","timestamp":1779102549677,"segment":1,"confidence":8.545454545454545,"asi":{"hypothesis":"The planning task-description checklist can drop the redundant word 'constraints' from integration/compat while preserving the requirement to capture compatibility considerations."}}
{"run":38,"commit":"79b6537","metric":2165,"metrics":{"words_SKILL":489,"words_execution":584,"words_planning":505,"words_sync":218,"guard_recoveryrequired":2,"guard_task_claim":6,"guard___append":13,"guard_task_done":11,"guard_blocked":24,"guard_subagent":12,"guard___toon":51,"guard_wipe___yes":2},"status":"keep","description":"Remove redundant actual from planning UUID handoff","timestamp":1779102583944,"segment":1,"confidence":9.466666666666667,"asi":{"hypothesis":"The planning handoff line can drop 'actual' before UUIDs while preserving the requirement to hand off real IDs and execution waves."}}
{"run":39,"commit":"0d5acc0","metric":2164,"metrics":{"words_SKILL":489,"words_execution":583,"words_planning":505,"words_sync":218,"guard_recoveryrequired":2,"guard_task_claim":6,"guard___append":13,"guard_task_done":11,"guard_blocked":24,"guard_subagent":12,"guard___toon":51,"guard_wipe___yes":2},"status":"keep","description":"Trim execution branch/PR permission phrase","timestamp":1779102614301,"segment":1,"confidence":9.225806451612904,"asi":{"hypothesis":"The execution lane brief can shorten the branch/commit/push/PR permission phrase without weakening the explicit-ask/allowed guardrail."}}
{"run":40,"commit":"6e26ed7","metric":2163,"metrics":{"words_SKILL":488,"words_execution":583,"words_planning":505,"words_sync":218,"guard_recoveryrequired":2,"guard_task_claim":6,"guard___append":13,"guard_task_done":11,"guard_blocked":24,"guard_subagent":12,"guard___toon":51,"guard_wipe___yes":2},"status":"keep","description":"Trim top-level branch/PR guardrail phrase","timestamp":1779102640600,"segment":1,"confidence":9,"asi":{"hypothesis":"The top-level branch/commit/merge/push/PR guardrail can match the shorter execution wording while preserving the require-ask and harness-allowed conditions."}}
{"run":41,"commit":"ff75721","metric":2162,"metrics":{"words_SKILL":488,"words_execution":583,"words_planning":505,"words_sync":217,"guard_recoveryrequired":2,"guard_task_claim":6,"guard___append":13,"guard_task_done":11,"guard_blocked":24,"guard_subagent":12,"guard___toon":51,"guard_wipe___yes":2},"status":"keep","description":"Trim sync destructive wipe repo wording","timestamp":1779102673243,"segment":1,"confidence":7.631578947368421,"asi":{"hypothesis":"The sync destructive-wipe warning can drop 'whole' while preserving the shared-storage/repo/linked-worktree deletion warning and destructive-recovery-only guardrail."}}
{"run":42,"commit":"f9c8141","metric":2160,"metrics":{"words_SKILL":488,"words_execution":583,"words_planning":503,"words_sync":217,"guard_recoveryrequired":2,"guard_task_claim":6,"guard___append":13,"guard_task_done":11,"guard_blocked":24,"guard_subagent":12,"guard___toon":51,"guard_wipe___yes":2},"status":"keep","description":"Condense planning new-entity status rule","timestamp":1779102701396,"segment":1,"confidence":7,"asi":{"hypothesis":"The planning rule for new entity statuses can remove redundant 'create as' wording while preserving the prohibition on starting items in in_progress, blocked, or done states."}}
{"run":43,"commit":"e30fb3c","metric":2158,"metrics":{"words_SKILL":488,"words_execution":581,"words_planning":503,"words_sync":217,"guard_recoveryrequired":2,"guard_task_claim":6,"guard___append":13,"guard_task_done":11,"guard_blocked":24,"guard_subagent":12,"guard___toon":51,"guard_wipe___yes":2},"status":"keep","description":"Shorten execution remaining-work closure wording","timestamp":1779102735200,"segment":1,"confidence":6.930232558139535,"asi":{"hypothesis":"Execution done/close criteria can use 'rest' instead of 'remaining work' while preserving the requirement that uncompleted work be blocked with reasons."}}
